Category,Number,Term ,Count,%,PValue,Genes,List Total,Pop Hits,Pop Total,Fold Enrichment,Bonferroni,Benjamini,FDR
Cellular Component,GO:0070062,extracellular exosome,175,11.72136638,0.001118436,"SEMA5A, STEAP4, AMY2A, CD82, AMY2B, COL12A1, DNHD1, LOXL4, DEFB1, AQP1, FBL, EFEMP1, BAIAP2L1, PLAU, DPYSL2, TNFSF10, CAPN2, UBASH3A, TOR3A, AMY1A, CACNA2D1, AMY1B, AMY1C, SLC6A14, MIR27B, KRT7, NPNT, TUBA4A, C1ORF116, COL4A2, MTHFD1, ARMC3, S100A6, PSME2, TNIK, IL6ST, MXRA5, UBA52, CFB, SLC26A2, SUCNR1, CFH, STXBP2, NEDD4L, SLC1A4, LIN7A, LTBP2, SLC5A1, FUT3, C3, EFNB1, C5, ALDH3B1, ST3GAL6, SFN, PROM1, RAB6A, MYH10, ST3GAL1, S100A11, CYP2J2, MUC16, SMURF1, INSR, CYBRD1, MSN, RAB27A, RAB27B, GP6, GNG12, PGA5, ARHGAP23, EHD2, DLG1, COL1A2, LOC102723996, GIPC2, ALB, NAPEPLD, FAT1, SERPINI2, HLA-DRA, SP8, MELTF, SLC26A4, HLA-DRB1, CC2D1A, CD22, LGMN, FERMT3, CLIC6, ALK, ORM1, BTG2, SERPINA1, PCDHGB5, WDR1, MTMR11, ARHGAP1, TNFAIP3, ADIRF, HSPB1, IL18BP, UPK1B, CSRP1, CRTAC1, CA2, H2BC21, NAPRT, TMEM109, MAN1A1, ACP3, GET3, CTSC, ZNF486, SERPINB1, ANXA1, MMP7, GSTO1, MYOF, AKR1A1, ARHGEF18, PEX1, TYK2, RHOF, IQCG, REXO5, ACTA2, DNM3, RAP2C, ANO1, ALDH1A3, ACTBL2, PXDN, MMRN2, PECAM1, VWA2, DNASE2, MFGE8, SFT2D2, CRYAB, SMPDL3A, RAPGEF3, CD44, SEMA3C, PON1, LAMA3, LCAT, PRELP, UACA, THBS1, FSTL1, GNAI1, GNA13, NT5E, SH3BGRL, GNG5, CCDC180, SLIT2, GPC4, CRYM, CD74, ATAD2, RFTN1, KRT10, PDZK1IP1, RAB11B, CAMK4, NEDD4, KRT14, MGP, TRIP10, FAS, VIM, CRB3",1242,2205,19595,1.252140685,0.557712979,0.081533995,0.080527402
Biological Process,GO:0032760,positive regulation of tumor necrosis factor production,17,1.138647019,0.001152469,"ORM1, IFNGR1, PTAFR, MIR27B, HSPB1, NOD2, TICAM1, THBS1, C1QTNF4, TLR1, IL1A, FRMD8, OAS3, FADD, TLR3, TMEM106A, HAVCR2",1193,106,18585,2.498418447,0.995672613,0.209173151,0.208375288
Cellular Component,GO:0005576,extracellular region,168,11.25251172,0.001335988,"LY6K, OLFML2B, AMY2A, SERPINE2, PLGLB1, AMY2B, SCT, COL12A1, AQP4, DEFB1, IL1RAP, FGF2, TNF, NPIPB15, ENDOU, EFEMP1, PLAU, EVA1C, LIPH, TNFSF10, KDR, CCN2, CCN1, PAMR1, IFNAR2, ST6GAL1, IL4R, AMY1A, AMY1B, FST, AMY1C, NPNT, TUBA4A, COL4A2, LOX, COL4A1, S100A6, COL8A1, IL6ST, MXRA5, CFB, CFH, STXBP2, KLK5, TNFRSF11B, LTBP2, FBXO45, CD99L2, LYPD6, GPR15LG, C3, C5, APOM, PDZD2, ARSJ, S100A11, CPA4, GSDMD, TFPI2, LIF, RAB27A, NMI, PGA5, NOTCH2NLC, BMP6, ADCY10, VNN1, COL1A2, VNN2, NMU, ALB, SP8, HPSE, MELTF, CTRC, MUC20, DAND5, LGMN, FERMT3, CNTNAP3, CXCL6, NRP2, ORM1, SERPINA1, CXCL8, WFIKKN1, TNFAIP6, WDR1, LEAP2, PLEK, PTEN, LAMC2, CXCL1, CXCL3, MSLN, PCSK5, CXCL2, HAPLN2, IL18BP, ESM1, C1QTNF2, NAPRT, CASP4, GAST, RSPO1, CFAP43, FGFBP3, CD34, HGFAC, CTSC, CFAP45, CHST9, EDN1, SERPINB1, FGFBP1, ANXA1, EDN2, SERPINB2, MMP7, IL15, HEG1, MAMDC2, IL18, TNFRSF1B, IL1A, F8, ADGRF1, C1QTNF12, PXDN, TNFRSF25, MFGE8, CFAP54, CCDC40, ITIH5, SEMA3C, PON2, DNAH5, PON1, LAMA3, LCAT, PRELP, AOAH, VWCE, PTN, UACA, THBS1, FSTL1, NTN1, PRRG4, FRZB, SPOCK2, ALOX5, AGR2, CCL2, SLIT2, APOL3, C17ORF67, RSPH4A, LAMB3, CCL20, DAW1, KISS1, KITLG, PSMC3, MGP, PTX3, HDGF, IL17C",1242,2117,19595,1.252022391,0.622651562,0.081820641,0.08081051
Cellular Component,GO:0000785,chromatin,94,6.296048225,0.001346842,"FANK1, FOXA1, RHOXF1, MCM7, FOXI1, HOXC10, ELK3, FOXQ1, HHEX, CHAF1B, CHAF1A, CAPN2, DPF3, HOXA2, SOX9, JUNB, PITX1, TP63, KLF11, TIPIN, BATF3, MEF2B, ZBTB37, EBF3, ETV1, PAX6, BHLHA15, ZHX1, POU5F1, FOXP1, MSH6, MYCL, MAU2, MYCN, PAX8, ELF4, IRF1, ELF5, HAND2, IRF7, ZFPM2, JDP2, ATF3, ASF1B, TRIM56, MCM2, NFIX, TSHZ3, CEBPD, UHRF1, DLX6, GATA6, BARX2, RELA, NPAS2, HOXC9, HOXC8, MEF2D, JUND, SLF2, SMAD3, IRX5, DMRT1, FANCL, VDR, PLK2, IRX3, PBX3, FANCA, NR1H3, FOXJ1, NFATC1, GRHL3, UBE2A, KLF4, SMAD6, POU2F3, TBX18, ESR2, KLF2, NR4A2, H1-5, FAM111B, NASP, TEF, STAG3, LHX2, NFIC, NEDD4, MAFF, SP8, MAFK, EZH2, TP73",1242,1077,19595,1.377005967,0.625629558,0.081820641,0.08081051
Biological Process,GO:0043280,positive regulation of cysteine-type endopeptidase activity involved in apoptotic process,11,0.736771601,0.001514067,"DAPK1, CASP1, TNFSF10, MIR27B, PMAIP1, CARD16, CCN2, CCN1, UACA, TNF, MAP3K5",1193,52,18585,3.295425237,0.999216557,0.233746625,0.23285503
Biological Process,GO:0038061,NIK/NF-kappaB signaling,11,0.736771601,0.001514067,"ALK, RIPK3, CHUK, IL18, MIR27B, NOD2, IKBKE, RELA, PSMB10, BIRC2, BIRC3",1193,52,18585,3.295425237,0.999216557,0.233746625,0.23285503
Biological Process,GO:1901224,positive regulation of NIK/NF-kappaB signaling,13,0.870730074,0.001529299,"EDN1, TNFSF14, IL18, NMI, NOD2, TNF, EGFR, RELA, C1QTNF4, IRAK1, TLR3, HAVCR2, TRIM56",1193,70,18585,2.893126572,0.999270985,0.233746625,0.23285503
Biological Process,GO:0019886,antigen processing and presentation of exogenous peptide antigen via MHC class II,8,0.535833891,0.001575296,"CD74, UNC93B1, HLA-DRA, CTSE, HLA-DRB1, HLA-DQA1, HLA-DPA1, LGMN",1193,28,18585,4.450963956,0.999413453,0.233746625,0.23285503
Biological Process,GO:0006270,DNA replication initiation,8,0.535833891,0.001575296,"POLA2, MCM7, ORC1, CCNE2, MCM4, GMNC, MCM6, MCM2",1193,28,18585,4.450963956,0.999413453,0.233746625,0.23285503
Biological Process,GO:0098609,cell-cell adhesion,25,1.674480911,0.001628588,"LAMA3, AQP4, NTN1, LPP, EGFR, PDLIM1, SRPX2, BAIAP2L1, CDH2, CDH24, SOX9, CD34, S100A11, KIRREL1, ANXA1, VMP1, DLG1, VNN1, CDHR1, ITGA11, FAT1, PECAM1, ADAM8, CD44, CD200",1193,195,18585,1.997227416,0.999544084,0.233746625,0.23285503
Biological Process,GO:0043066,negative regulation of apoptotic process,53,3.549899531,0.001634592,"FANK1, TNFAIP8, PTEN, FHL2, HSPB1, TNF, IFIT3, GLI2, AQP1, EDNRB, ADORA1, PIM1, KDR, SOX9, CCN1, IER3, ANXA1, SERPINB2, DAPK1, AKR1A1, RNF144B, IL6ST, CRYAB, PTMA, CD44, BIRC2, BIRC3, AMIGO2, GATA6, THBS1, FSTL1, EGFR, RELA, MYCNOS, NUAK2, UCP2, PAK2, TNFSF18, CD74, PLK3, STIL, SMAD3, PLK2, ASNS, MIR200B, LOC102724560, SMAD6, HYPK, NOTCH2NLC, SH3RF2, LSM8, ALB, FAS",1193,532,18585,1.551980853,0.999556843,0.233746625,0.23285503
Biological Process,GO:0007165,signal transduction,110,7.367716008,0.001852258,"OLFML2B, CD83, SCT, CBLC, CXCL14, FGF2, ELK3, ENDOU, GJA1, OPHN1, PLAU, DPYSL2, RASSF5, TNFSF10, ADORA1, SOX9, CCN2, CCN1, GUCY1A2, IL4R, DAPK1, STARD8, AKAP9, S100A6, CARD16, OPTN, DGKH, SKAP2, CHRNA5, TNFRSF11B, MST1R, C3, SFN, FADD, SRGAP2, MAP2K7, FAM83B, S100A11, TNFSF18, STARD13, TNFSF14, THAP12, GNG12, GNG11, ESR2, ARHGAP23, NR4A2, EXT1, ARHGAP31, LOC102723996, OGT, FGF12, HLA-DRB1, BCAR3, ALK, CXCL6, CXCL8, TNFAIP6, ARHGAP1, CXCL1, ARHGAP4, C1QTNF4, CASP1, GAST, CD34, FGFBP1, ANXA1, RIPK3, IL15, IFNGR1, HUNK, RHOF, TLR1, RAP2C, MRAS, CEACAM6, PECAM1, TNFRSF25, TLR6, ITGB1BP2, ITGB3BP, RAPGEF3, TLR3, DTHD1, PKN3, ADCY3, NEDD9, EGFR, TYMP, GNA13, GNG5, CHN2, LRRC8C, CCL2, LRRC8B, GABRE, PAK2, LRRC8E, MPP1, CCL24, IL10RB, CCL20, BMP8B, GPR141, CAMK4, TRIP10, FAS, HDGF, CMTM2, PDE7B",1193,1293,18585,1.32530636,0.99984166,0.253318863,0.252352612
Biological Process,GO:0002281,macrophage activation involved in immune response,6,0.401875419,0.001878822,"SBNO2, SUCNR1, NMI, TICAM1, TNF, HAVCR2",1193,15,18585,6.231349539,0.999860351,0.253318863,0.252352612
Molecular Function,GO:0005201,extracellular matrix structural constituent,20,1.339584729,0.001926247,"LAMB3, LAMA3, TFPI2, PRELP, LAMC2, LTBP2, NPNT, THBS1, SRPX2, EFEMP1, COL1A2, COL4A2, COL4A1, MGP, MMRN2, PXDN, COL8A1, CCN1, MFGE8, MXRA5",1207,138,18178,2.182678338,0.922137441,0.286749797,0.285884137
Molecular Function,GO:0004896,cytokine receptor activity,11,0.736771601,0.001947734,"IL22RA1, IFNAR2, CD74, IL4R, FZD4, IFNGR1, IL10RB, IL6ST, OSMR, CD44, IL12RB2",1207,52,18178,3.185870881,0.924325582,0.286749797,0.285884137
Biological Process,GO:0006974,cellular response to DNA damage stimulus,33,2.210314802,0.002036701,"BTG2, MCM7, UBA6, UHRF1, FMR1, SMC5, FBXO45, ALKBH7, NPAS2, ZC3H12A, PMAIP1, SUSD6, IKBKG, TP63, IER3, MCTS1, PLK3, TIPIN, SLF2, FANCL, ZBTB38, XRCC3, BAZ1B, WDR76, FOXP1, RNF168, RNF169, SLFN11, IRF7, SGK1, SPATA18, DTL, TP73",1193,291,18585,1.766619715,0.999933813,0.261289265,0.260292611
Biological Process,GO:0001501,skeletal system development,19,1.272605492,0.002101036,"WFIKKN1, VDR, FST, DLX6, BMP8B, PRELP, TNFRSF11B, BMP6, HOXC10, HAPLN2, GLI2, EXT1, COL1A2, FRZB, USP1, SOX9, PITX1, TP63, EPHA2",1193,133,18585,2.225481978,0.999951178,0.261289265,0.260292611
Biological Process,GO:0070542,response to fatty acid,7,0.468854655,0.002104046,"PCSK1, PON1, UCP2, MBP, CCN2, SOX9, PTGS2",1193,22,18585,4.956755315,0.999951868,0.261289265,0.260292611
Biological Process,GO:0006935,chemotaxis,18,1.205626256,0.00219817,"CCL24, CXCL6, CXCL8, CCL20, PTAFR, CXCL1, DEFB1, PLD1, FGF2, CXCL2, CXCL14, TYMP, AMOT, C5, PLAU, CCL2, CMTM2, CCN1",1193,123,18585,2.279762026,0.999969163,0.265978561,0.264964021
Biological Process,GO:2001238,positive regulation of extrinsic apoptotic signaling pathway,8,0.535833891,0.002420736,"CYLD, CAV1, TNFSF10, G0S2, FADD, TLR6, TNF, PAK2",1193,30,18585,4.154233026,0.999989241,0.285586332,0.284497001
Biological Process,GO:0048566,embryonic digestive tract development,6,0.401875419,0.002589734,"CXCL8, SCT, TNF, PCSK5, GLI2, STRA6",1193,16,18585,5.841890193,0.999995164,0.298072017,0.296935061
Cellular Component,GO:0005737,cytoplasm,400,26.79169457,0.002856881,"TES, PID1, AVIL, SMC5, FZD10, CHKB-CPT1B, ABCA12, CLDN1, ALKBH6, MYLK, RNF112, ENDOU, GJA1, RAVER1, WDR90, DPYSL2, ZC3H12A, DPYSL3, HOMER3, UBASH3A, GAMT, GBP5, DAPK1, PASK, DNAAF8, EML3, SYTL2, DDX39A, PSME2, CYP2E1, UBA52, OPTN, IDO1, SKAP2, MTMR1, SLBP, LXN, NEDD4L, LYPD6, SKA2, RNF213, CFAP69, SFN, NRBF2, S100A11, TOE1, PLK3, GSDMC, STARD13, GSDMB, GSTM1, PLK2, NFATC1, MRPL21, EHD2, UCK2, GIPC2, NAPEPLD, FARSA, CDK14, EZH2, LGMN, FANK1, BTG2, MTMR11, ARHGAP1, ARHGAP4, FARS2, PANX2, CHAF1B, CSRP1, IKBKG, IKBKE, CEP55, ANXA1, SERPINB2, RIPK3, GSTO1, PAX6, EMP2, TACR1, LRRC41, POU5F1, CDC20B, CACTIN, CRYAB, GAS7, KANK2, PKN3, ADCY3, PTGS2, HSPA14, EGFR, SRPX2, FRZB, ALOX5, MBNL3, MEF2D, APOL3, CDKN2D, CDKN2B, ANKIB1, EGLN2, NR1H3, PSMC3, PLCD3, FMR1, FAM107A, FGF2, PTAR1, CDH2, RNF19A, PIM1, PITX1, MAP3K5, PIAS4, SNRPN, FST, TUBA4A, CLIP2, VMAC, MAG, C1ORF116, STIM2, MAK, S100A6, ADAM8, TNIK, DGKI, DGKH, LRRC51, FBXO45, AK5, NPAS2, STRA8, NPAT, SOCS1, NACC1, KHDC1, ZNF425, MAP2K7, SRGAP2, SAC3D1, SEC16B, FANCL, CCDC14, TRAPPC5, HPS1, FANCA, NSG1, FBXO32, LOC102724560, ADAP1, KY, LSM8, ADCY10, RGCC, ALB, RNF182, ZNF655, MAP3K13, BCAR3, PIWIL1, SCHIP1, PTEN, ADRA1B, HHEX, LBH, CCDC50, CHUK, VBP1, DHPS, RAD23A, HAUS1, C1QL1, ACTBL2, MYO3A, TESMIN, DNAJC9, BIRC2, MCM2, BIRC3, CCDC40, TRIM56, CCDC68, SHCBP1L, NOD2, NTN1, HDAC9, DEPP1, HAUS8, TIFA, LRRC8C, LRRC8B, FNIP2, LRRC8E, PPP1R14C, IRX3, AHNAK2, PTPN12, KLF4, SCART1, PC, SPAG1, MYO1F, GORAB, JPT2, AQP4, IFIT1, NADSYN1, IFIT3, AQP1, IFIT2, RPS6KA4, OPHN1, RASSF5, AGFG2, TP63, TIPIN, KRT7, YOD1, AKAP9, SIK1, SIK2, CCDC81, SPATA18, ZFPM2, BLZF1, MACF1, LPAR3, BRCC3, CD1D, BRIP1, NUAK2, STK38L, HIVEP3, FADD, APOBEC3D, TNFSF14, GADD45A, XRCC3, IFI44, NMI, PARP14, LRP2BP, KYAT3, CD22, TP73, CLIC6, KIF11, SH3PXD2A, LMCD1, CD34, EDN1, IL15, IL18, TYK2, PLAAT4, RAP2C, RNF144B, ANO1, KIF2A, PITPNM3, RGS7BP, SGK1, RAPSN, ARHGEF5, TLR3, DYNLT2B, NEDD9, VWCE, RGPD4, GNAI1, RELA, SH3BGRL, PLEKHG4B, PAK3, PAK2, UBL4A, MAP3K3, SVIL, CD74, RANBP3, DMRT1, RFTN1, SORBS2, MYO9B, SORBS1, KRT10, HYPK, KITLG, PER3, NEDD4, CAMK4, KRT14, TRIP10, PNPLA4, HDGF, CAPS, PRAG1, PRDM1, IFI44L, AMOT, KHSRP, CAPN2, RGS9, GUCY1A2, CFAP418, LMO3, NANOS3, IRAG2, IPCEF1, MAP7D3, CCNE2, MAP7D1, ELMO1, ELMO3, CARD16, ISYNA1, UBA6, PLCXD1, INAVA, CACNA1G, MYCNOS, EFNB1, PDZD2, IRAK1, IRAK2, ALDH3B1, MYH10, FAM83B, CYP2J2, STIL, SMAD3, VDR, SMURF1, ECD, ARHGAP29, MSN, TBCB, SMAD6, BMP6, GULP1, NR4A2, DLG1, NASP, FGF12, TNFAIP8, MAST4, MAST3, PLEK, HSPB1, TNFAIP3, IQCJ-SCHIP1, RBM4, CA2, CASP4, CASP1, LRRFIP1, CFAP43, GET3, SCYL1, DYNLT4, HUNK, ARHGEF18, C4ORF46, PEX1, SHROOM1, IQCG, ACTA2, DNM3, ALDH1A3, CCNA1, IRF1, OAS3, IRF7, CFAP58, ITGB3BP, RBMS3, RGS17, DNAH5, PDXP, NT5C2, GNA13, POLD3, PDLIM1, TNKS2, MARVELD1, S1PR3, SLIT2, CRYM, GBP2, GBP3, WTAP, DAW1, KISS1, LNX1, VIM, SNTB2, RBM44",1242,5615,19595,1.123916126,0.875773303,0.154566871,0.152658638
Biological Process,GO:0007155,cell adhesion,54,3.616878768,0.002947398,"CNTNAP3, SEMA5A, NRP2, PCDHGB5, TNFAIP6, COL12A1, LAMC2, MSLN, CLDN1, HAPLN2, CLDN22, CDH2, EMB, CCN2, ITGB6, CCN1, CD34, ROM1, EMP2, NPNT, MAG, CDHR1, NINJ2, PXDN, MMRN2, COL8A1, CLDN16, MFGE8, CD44, ITGB3BP, EPHA2, FBLN7, LAMA3, AMIGO2, NEDD9, CD99L2, THBS1, PCDH18, EFNB1, PDZD2, CCL2, MYH10, MUC16, LAMB3, PCDHGC4, PCDH7, TPBG, KITLG, PPFIBP1, SELL, ITGA11, SSPN, FAT1, CD22",1193,560,18585,1.502200335,0.99999911,0.324437416,0.323199892
Biological Process,GO:0010575,positive regulation of vascular endothelial growth factor production,8,0.535833891,0.002956306,"C3, IL1A, CCBE1, C5, HPSE, IL6ST, PTGS2, RELA",1193,31,18585,4.020225509,0.999999147,0.324437416,0.323199892
Biological Process,GO:0043406,positive regulation of MAP kinase activity,13,0.870730074,0.003133074,"EDN1, FLT1, INSR, MST1R, NOD2, FGF2, THBS1, TNF, EGFR, KITLG, IRAK1, ADAM8, EZH2",1193,76,18585,2.664721842,0.999999631,0.336022186,0.334740474
Cellular Component,GO:0030658,transport vesicle membrane,9,0.602813128,0.003157755,"CD74, SYT10, HLA-DRA, ABCA12, SYTL4, HLA-DRB1, HLA-DQA1, SNTB2, HLA-DPA1",1242,40,19595,3.549818841,0.900305619,0.154566871,0.152658638
Cellular Component,GO:0042995,cell projection,24,1.607501674,0.003180388,"MACF1, SVIL, WDR1, AVIL, FMR1, PTEN, MRI1, FBXO45, RHOF, PTPN12, MCOLN1, FCHSD1, ANO1, CYLD, SH3PXD2A, PITPNM3, TRIP10, RHOU, CFAP43, TNS3, OGT, CD44, ARHGEF5, FERMT3",1242,196,19595,1.931874199,0.901942159,0.154566871,0.152658638
Biological Process,GO:0045987,positive regulation of smooth muscle contraction,6,0.401875419,0.003477024,"EDN1, EDN2, NMU, TACR2, NPNT, PTGS2",1193,17,18585,5.498249593,0.999999928,0.364623886,0.363233076
Biological Process,GO:0045089,positive regulation of innate immune response,8,0.535833891,0.003577998,"GBP5, ADAM8, CD1D, FADD, NMI, NOD2, HAVCR2, TRIM56",1193,32,18585,3.894593462,0.999999955,0.367055951,0.365655864
Cellular Component,GO:0071162,CMG complex,5,0.334896182,0.003685954,"GINS2, MCM7, MCM4, MCM6, MCM2",1242,11,19595,7.171351193,0.932256362,0.162653218,0.160645154
Biological Process,GO:0042102,positive regulation of T cell proliferation,12,0.803750837,0.0037851,"EFNB1, KITLG, ANXA1, IL15, DHPS, PRKCQ, CD1D, TYK2, IL6ST, HAVCR2, HLA-DPA1, IL12RB2",1193,68,18585,2.749124797,0.999999983,0.380040099,0.378590487
Cellular Component,GO:0030054,cell junction,27,1.808439384,0.003793011,"MACF1, TES, WDR1, SCHIP1, C4ORF19, SMC5, EGFR, AMOT, IQCJ-SCHIP1, GJA1, CDH2, SH3PXD2A, NACC1, KDR, ITGB6, HAVCR2, MEF2B, CFAP418, ARHGEF18, GTF2F1, ELL3, TSPAN15, DLG1, ARHGEF5, CRB3, SNTB2, TP73",1242,234,19595,1.820419918,0.937360678,0.162653218,0.160645154
Biological Process,GO:0045766,positive regulation of angiogenesis,21,1.406563965,0.003952746,"SEMA5A, CCL24, CCBE1, FLT1, CXCL8, GATA6, MIR27B, HSPB1, EMP2, FGF2, THBS1, AQP1, C3, IL1A, C5, ZC3H12A, KDR, HPSE, CD34, RAPGEF3, TLR3",1193,163,18585,2.007029759,0.999999992,0.383979584,0.382514944
Biological Process,GO:0010629,negative regulation of gene expression,34,2.277294039,0.003987073,"DNMT1, CXCL8, CDKN2B-AS1, PRDM1, FGF2, TNF, MIR106B, GJA1, BRIP1, ZC3H12A, KDR, SOX9, CCN2, ROS1, CD34, HAVCR2, EDN1, SMAD3, SFMBT2, MIR27B, MIR200B, PARP14, KLF4, POU5F1, NOTCH2NLC, FOXP1, MYCN, PC, MIR186, HAND2, MYADM, CRYAB, LGMN, RBMS3",1193,316,18585,1.676154148,0.999999994,0.383979584,0.382514944
Biological Process,GO:0007267,cell-cell signaling,27,1.808439384,0.004213923,"SEMA5A, PCSK1, CXCL6, TNFAIP6, ADRA1B, PCSK5, CXCL14, PANX2, EFNB1, GJA1, ADORA1, TNFSF10, FGFBP3, FZD1, TNFSF18, CCL24, EDN1, FGFBP1, IL15, CCL20, IL18, BHLHA15, ESR2, EFNA2, FAT1, FGF12, IL17C",1193,233,18585,1.805219287,0.999999998,0.397347772,0.395832141
Biological Process,GO:0003281,ventricular septum development,8,0.535833891,0.004294286,"PAX8, HEG1, CNTRL, PRDM1, CCN1, SMAD6, DAND5, STRA6",1193,33,18585,3.776575478,0.999999998,0.397347772,0.395832141
Biological Process,GO:0010193,response to ozone,4,0.267916946,0.004544548,"IL1A, EDN1, CYP2E1, TACR1",1193,6,18585,10.38558256,1,0.402484617,0.400949393
Biological Process,GO:0072531,pyrimidine-containing compound transmembrane transport,4,0.267916946,0.004544548,"AQP9, SLC28A2, SLC28A1, SLC28A3",1193,6,18585,10.38558256,1,0.402484617,0.400949393
Biological Process,GO:0019221,cytokine-mediated signaling pathway,20,1.339584729,0.004605673,"IFNAR2, IL4R, EDN2, FZD4, IFNGR1, IL10RB, CAV1, TYK2, OSMR, RELA, IL22RA1, IL1A, SOCS1, IRAK1, IRAK2, IFNE, CCL2, IL6ST, CD44, IL12RB2",1193,154,18585,2.023165435,1,0.402484617,0.400949393
Cellular Component,GO:0031526,brush border membrane,11,0.736771601,0.004692905,"GNA13, SLC34A2, NPC1L1, CYBRD1, SLC5A1, SLC28A2, SLC26A4, TRPM6, SLC28A1, AQP1, SLC28A3",1242,61,19595,2.84502785,0.967586503,0.190062647,0.187716194
Biological Process,GO:0051056,regulation of small GTPase mediated signal transduction,17,1.138647019,0.00493998,"STARD13, ARHGAP1, ARHGAP29, MYO9B, RHOF, GMIP, ARHGAP23, ARHGAP4, AMOT, GNA13, PREX2, ARHGAP31, CHN2, PLEKHG4B, RHOU, SRGAP2, ARHGEF5",1193,122,18585,2.170757012,1,0.423850259,0.422233539
Molecular Function,GO:0070412,R-SMAD binding,7,0.468854655,0.004999217,"RANBP3, RGCC, SMAD3, SMURF1, PMEPA1, PAX6, SMAD6",1207,25,18178,4.216934548,0.998687161,0.60275877,0.600939121
Molecular Function,GO:0004704,NF-kappaB-inducing kinase activity,4,0.267916946,0.005004035,"ALK, IRAK1, RIPK3, IKBKE",1207,6,18178,10.04032035,0.998695551,0.60275877,0.600939121
Biological Process,GO:0006915,apoptotic process,57,3.817816477,0.005154103,"KLLN, TNFAIP8, PTEN, TNFAIP3, TCIRG1, RASSF5, ZC3H12A, CASP4, TNFSF10, PIM1, CASP1, IKBKG, TP63, CTSC, IER3, KLF11, HELLS, UNC5B, DAPK1, EMP2, RNF144B, ALDH1A3, IL1A, CEACAM6, IRF1, ELMO1, MAL, TNFRSF25, ELMO3, CARD16, SGK1, BIRC2, ITGB3BP, BIRC3, MCM2, KANK2, TNFRSF11B, THBS1, NTN1, NUAK2, PMAIP1, FADD, MAP2K7, PAK2, MEF2D, PLK3, TNFSF14, GADD45A, BIK, CARD6, NSG1, NOTCH2NLC, GULP1, PPP2R2B, FAS, OGT, TP73",1193,615,18585,1.443849283,1,0.425200097,0.423578228
Biological Process,GO:0002224,toll-like receptor signaling pathway,7,0.468854655,0.005210636,"TLR1, IRAK1, UNC93B1, TLR6, TICAM1, TLR5, TLR3",1193,26,18585,4.194177574,1,0.425200097,0.423578228
Biological Process,GO:0043491,protein kinase B signaling,13,0.870730074,0.005327747,"PLK3, EDN1, PTEN, FGF2, TNF, DLG1, LOX, C1QTNF12, KDR, CCL2, SOX9, NDP, EPHA2",1193,81,18585,2.50023284,1,0.425200097,0.423578228
Cellular Component,GO:0005794,Golgi apparatus,94,6.296048225,0.005353679,"SERPINA1, GALNT16, GORAB, MSLN, PCSK5, LITAF, CXCL14, ARHGAP4, WDR44, GJA1, RUSC1, NDST3, CAPN2, KDR, MAN1A1, CCN2, UBASH3A, ERMAP, CTSC, SCYL1, GBP5, ST6GAL1, IL15, MMD, EMP2, RAD23A, ZDHHC11, CASD1, ZDHHC14, MSH6, TLR1, DNM3, AKAP9, FAM20B, S100A3, TLR6, RAB7B, VAMP4, CRYAB, OPTN, RAPSN, CD44, BLZF1, MACF1, SLC35D1, FAM114A1, PKN3, ZDHHC23, NEDD9, NEDD4L, ADCY3, SGMS2, NOD2, PLD1, BARX2, FUT4, TMEM165, FUT3, AP3M1, ARL17A, ST8SIA5, HAS2, ST3GAL6, CLSPN, GBP2, RAB6A, ST3GAL1, GBP4, KCNJ2, RHBDD2, ST8SIA1, CAV2, GPR108, CAV1, TRAPPC5, AP3D1, RAB27A, RAB27B, MCOLN1, SMAD6, HS3ST1, RAB11B, EXT1, DLG1, SYNDIG1L, ZDHHC9, STING1, NEDD4, ALB, NAPEPLD, TRIP10, SLC35E2B, SNTB2, TP73",1242,1129,19595,1.313583195,0.980025852,0.205412198,0.202876245
Biological Process,GO:0043507,positive regulation of JUN kinase activity,9,0.602813128,0.00542612,"EDN1, FZD4, FZD10, TLR6, MAP3K13, MAP2K7, TNF, ARHGEF5, MAP3K5",1193,43,18585,3.260589875,1,0.425200097,0.423578228
Biological Process,GO:0002675,positive regulation of acute inflammatory response,5,0.334896182,0.005496335,"C2CD4A, ADAM8, C2CD4B, IL6ST, OSMR",1193,12,18585,6.490989103,1,0.425200097,0.423578228
Biological Process,GO:0000727,double-strand break repair via break-induced replication,5,0.334896182,0.005496335,"GINS2, MCM7, MCM4, MCM6, MCM2",1193,12,18585,6.490989103,1,0.425200097,0.423578228
Biological Process,GO:0098586,cellular response to virus,14,0.93770931,0.005741587,"IFNAR2, SMAD3, CHUK, IFNGR1, IL10RB, FMR1, TYK2, VWCE, GLI2, EXT1, IFNE, ZC3H12A, IKBKE, TLR3",1193,92,18585,2.370622107,1,0.43700887,0.435341957
Biological Process,GO:0061436,establishment of skin barrier,8,0.535833891,0.00604542,"ELOVL1, IL18, SFN, GRHL3, KLF4, ABCA12, CLDN1, TP63",1193,35,18585,3.560771165,1,0.452830764,0.451103501
Cellular Component,GO:0010008,endosome membrane,29,1.942397857,0.006239814,"ARHGAP1, AQP4, TCIRG1, CD1D, EGFR, TMEM165, WDR44, IRAK1, IRAK2, WDR91, PMEPA1, SLC15A3, HLA-DQA1, HLA-DPA1, ANXA1, INSR, AP3D1, ZDHHC11, MCOLN1, TICAM1, EHD2, IRF7, HLA-DRA, RHOU, STEAP1, UBA52, STEAP2, HLA-DRB1, TLR3",1242,267,19595,1.713603768,0.989570072,0.227441235,0.224633318
Biological Process,GO:0042098,T cell proliferation,9,0.602813128,0.006267281,"EFNB1, GJA1, DLG1, KITLG, TNFSF14, MSN, LIPA, PSMB10, IDO1",1193,44,18585,3.18648556,1,0.462114047,0.460351374
Biological Process,GO:0032088,negative regulation of NF-kappaB transcription factor activity,14,0.93770931,0.006886392,"PIAS4, CHUK, TNFAIP3, FOXJ1, NOD2, KLF4, CYLD, NWD1, IRAK1, IRAK2, ZC3H12A, CACTIN, CD200, HAVCR2",1193,94,18585,2.320183339,1,0.499952073,0.498045072
Biological Process,GO:0032570,response to progesterone,8,0.535833891,0.00709793,"PTGER2, CAV1, NR1H3, UBE3A, MBP, TACR1, THBS1, RELA",1193,36,18585,3.461860855,1,0.507501997,0.505566198
Molecular Function,GO:0003700,"transcription factor activity, sequence-specific DNA binding",57,3.817816477,0.007243964,"FOXA1, ERV3-1-ZNF117, RHOXF1, FOXI1, PRDM1, GLI2, ELK3, SOX9, JUNB, PITX1, ZNF367, TP63, KLF11, BATF3, MEF2B, ZBTB38, SKIDA1, EBF3, ETV1, PAX6, BHLHA15, ZHX1, POU5F1, FOXP1, MYCL, MYCN, PAX8, IRF1, IRF7, ZNF358, JDP2, ATF3, NFIX, DLX6, GATA6, RELA, NPAS2, ZNF469, HOXC9, MEF2D, JUND, SMAD3, VDR, PBX3, FOXJ1, NFATC1, KLF4, POU2F3, TBX18, ESR2, KLF2, TEF, NFIC, MAFF, MAFK, ZNF414, TP73",1207,605,18178,1.418921306,0.999934004,0.750212761,0.747947967
Biological Process,GO:0035589,G-protein coupled purinergic nucleotide receptor signaling pathway,5,0.334896182,0.007540523,"P2RY6, P2RY4, P2RY2, P2RY1, PTAFR",1193,13,18585,5.991682249,1,0.523602574,0.521605361
Biological Process,GO:1904823,purine nucleobase transmembrane transport,4,0.267916946,0.007575138,"AQP9, SLC28A2, SLC28A1, SLC28A3",1193,7,18585,8.901927913,1,0.523602574,0.521605361
Biological Process,GO:0042127,regulation of cell proliferation,21,1.406563965,0.007655982,"ALK, ANXA1, IL4R, PID1, JUND, TES, FANCL, PTGER2, FANCA, PRDM1, EGFR, FUT3, PLAU, SOX9, PLCD3, SGK1, JUNB, BIRC2, S100A11, EZH2, KCNH1",1193,173,18585,1.891016479,1,0.523602574,0.521605361
Molecular Function,GO:0000976,transcription regulatory region sequence-specific DNA binding,27,1.808439384,0.008052507,"FOXA1, CIITA, GATA6, FOXI1, TNF, RELA, HHEX, TP63, KLF11, JUND, SMAD3, NR1H3, ARID5B, FOXJ1, PAX6, KLF4, SMAD6, TBX18, POU5F1, PER3, PAX8, IRF1, HAND2, IRF7, MAFK, ATF3, TP73",1207,237,18178,1.715750946,0.99997756,0.750212761,0.747947967
Biological Process,GO:0007049,cell cycle,37,2.478231748,0.008060409,"KLLN, MCM7, UHRF1, FAM107A, NEDD9, BRCC3, KIF11, GNAI1, CHAF1B, CHAF1A, SENP5, MARVELD1, CNTRL, PIM1, TP63, CDKN2D, MCTS1, CDT1, HELLS, CDKN2B, TIPIN, WTAP, APEX2, CABLES1, KLHL42, CYLD, RGCC, NASP, MCM4, GAS1, GMNC, SIK1, MCM6, SPC24, ITGB3BP, MCM2, TP73",1193,369,18585,1.562059166,1,0.543386706,0.541314029
Molecular Function,GO:0005372,water transmembrane transporter activity,4,0.267916946,0.008326877,"AQP9, AQP4, SLC5A1, AQP1",1207,7,18178,8.605988874,0.999984442,0.750212761,0.747947967
Cellular Component,GO:0005654,nucleoplasm,290,19.42397857,0.008379585,"GORAB, SMC5, FZD10, LIPA, ALKBH6, NPIPB15, ELK3, RPS6KA4, RNF112, GJA1, BAIAP2L1, PSMD5, ZC3H12A, HOXA2, PIP4K2A, DPF3, SOX9, UBASH3A, JUNB, TP63, TIPIN, MEF2B, SFMBT2, ACSL5, DDX39A, PSME2, ZFPM2, UBA52, BLZF1, OPTN, ATF3, SKAP2, ASF1B, SLBP, TSHZ3, GATA6, NEDD4L, C2CD4A, BRCC3, HTATSF1, RNPC3, BRIP1, TSPAN2, NRBF2, HOXC9, HOXC8, GTF2IRD2B, NR2C2AP, TOE1, GSDMD, CDT1, PLK3, JUND, GADD45A, XRCC3, NFATC1, NMI, NOTCH2NLC, ELL3, H1-5, POLA2, STAG3, HNRNPF, NAPEPLD, CDK14, SUGP2, EZH2, TP73, FANK1, KLLN, FEN1, ELL, SPIN4, SETD9, MCUB, ADIRF, LRRC32, LITAF, HOXC10, DDA1, GLI2, LIMD2, ARHGAP4, CHAF1B, ING3, IKBKG, ZNF367, LMCD1, IKBKE, CTSC, BATF3, RMI2, ANXA1, IL15, GSTO1, NSUN5, PAX6, GMIP, BAZ1B, ZHX1, POU5F1, RNF168, ANO1, RNF169, PAX8, KIF2A, FAM20B, TUT1, CACTIN, SGK1, PTMA, CRYAB, MGLL, ARHGEF5, NFIX, SYNPO2, NEDD9, SGMS2, GNAI1, RELA, CENPC, NT5E, BTAF1, ALOX5, CAMK2N2, USP1, MBNL3, MEF2D, CBR3, CDKN2D, UBL4A, CENPU, GINS2, RSPH4A, EGLN2, RANBP3, SLF2, SF3A2, ATAD2, APEX2, NR1H3, GRHL3, VWA3B, HYPK, NUDT22, XAB2, SH3RF2, PSMC3, STING1, NFIC, CAMK4, CENPK, TRIP10, HDGF, PLCD3, CAPS, SPC24, FOXA1, STEAP4, FMR1, POGK, C4ORF19, PRDM1, AMOT, FBL, RBMX2, KHSRP, ZNF85, PIM1, SLC16A7, PIAS4, TLE4, SNRPN, IL4R, ZBTB38, NANOS3, ZBTB37, ARID5B, KAZN, THOC2, GTF2F1, EMSY, FOXP1, MSH6, MYCL, MAU2, MYCN, SLFN11, CCNE2, FRMD8, TNIK, SREK1, DNMT1, AKNA, FAM114A1, MRI1, AK5, NPAS2, INAVA, SEL1L3, NPAT, SOCS1, IRAK1, ORC1, NACC1, ZNF425, CLSPN, SRGAP2, STIL, SMAD3, RHBDD2, VDR, SMURF1, FANCL, ECD, FANCA, UBE2A, FBXO32, SMAD6, LSM4, POU2F3, ESR2, NR4A2, LSM8, RGCC, NASP, MAFF, MAFK, HPSE, OGT, PHF19, CIITA, TNFAIP8, RHOXF1, MCM7, SCHIP1, PTEN, FHL2, RBM4, SENP5, H2BC21, ITGB6, GET3, NPIPA5, CFAP45, KLF11, RFC4, CHUK, RFC2, VEZF1, RAD23A, GCNA, SMC1B, CCNA1, DBF4, SETBP1, ELF4, IRF1, OAS3, IRF7, MCM4, LCOR, DNAJC9, MCM6, DTL, ITGB3BP, MCM2, BIRC3, TRIM56, CEBPD, UHRF1, MLLT1, PPM1D, HDAC9, NTN1, UACA, BARX2, PSMB10, POLD3, RBBP8, GBP2, MUTYH, WTAP, PTPN12, KLF4, MCOLN1, TBX18, DHODH, H3-7, SNTB2",1242,4029,19595,1.135597434,0.997833095,0.290891306,0.287300056
Molecular Function,GO:0045028,G-protein coupled purinergic nucleotide receptor activity,5,0.334896182,0.008492975,"P2RY6, P2RY4, P2RY2, P2RY1, PTAFR",1207,13,18178,5.792492512,0.999987537,0.750212761,0.747947967
